Headline,Content,Author,Date,URL,Brand,Label
#TPonMB: Duterte Youths Cardema vs Comelecs Guanzon,"Over the past several weeks, weve been witness to the word war between former National Youth Commission and Duterte Youth party-list nominee Ronald Cardema and Comelec commissioner Rowena Guanzon, with the core issue being Cardemas eligibility as Duterte Youths first nominee.

[NOTE: This piece was first published in the Manila Bulletin on 24 August 2019.]


Comelec on one hand sees Duterte Youth, as its name suggests, a youth sector party-list, so that the age limit on nominees (no older than 30 years by law) apply. The 34-year-old Cardema, meanwhile, argues that the party represents young professionals (yuppies), who are generally defined as professionals in their 20s or 30s.

Cardema has always been a controversial figure but the rift formally started in late May when Guanzon questioned Cardemas eligibility. This is after Duterte Youth petitioned to replace the five original nominees with a new set where Cardema is on top. The Comelec in early June approved the substitution but Guanzon in her dissenting opinion raised the age issue.

A media war happened afterward, and it escalated to new levels when Guanzon in a mid-July tweet published an alleged text threat along with the comment Who do you think sent this? Obviously. The public felt Guanzon was alluding to Cardema, an allegation Cardema swiftly denied.

The Comelec in early August cancelled Cardemas nomination on grounds of age.

A little later, Cardema accused Guanzon of extortion as he claimed she asked him for a large sum and the appointment of several officials. Guanzon shrugged off the allegations.

Cardema and Guanzon threatened to sue each other, with Cardema going the extra mile by blaming Guanzons tirades for making his relatives sick.

Cardema then publicly requested for the Palaces help, a request that the Palace swiftly denied.

Cardemas motion for reconsideration is still pending and he told this writer in a recent (and quite lengthy) phone conversation that he is still hopeful that it will be granted.

Guanzon, meanwhile, is on a roll. We have to give the commissioner some credit: she has a knack for zingers that Cardema sorely lacks.


All things considered, I cannot help but view the odds are stacked against Cardema while Guanzon has basically nothing to lose. That is, the current political landscape vis--vis the Guanzon-Cardema rift suggests that Cardemas moves over the past several months may have been a series of gargantuan political miscalculations.

FIRST, Guanzon has little to lose. This is just one of the myriad electoral cases Guanzon handles and she will remain a commissioner no matter how this turns out.


Impeachment is a political exercise so that Cardemas impeachment raps versus Guanzon are unlikely to prosper, as major blocs in both Houses are not exactly fond of Cardema. Moreover, will the Palace be willing to sideline its legislative agenda for the Senate to conduct months worth of impeachment trial? I highly doubt it.

SECOND, Cardema has limited political capital.

Guanzons July tweet may have been construed as alluding to Cardema but Guanzon didnt specifically refer to him, offering her the option to exercise plausible deniability. Cardema, however, took the bait and publicly retaliated with little success.

Guanzon, in just one tweet, managed to expose the limitations of Cardemas political capital.

In a world of rainbows, butterflies, unicorns, and teletubbies, everything boils to down to a question of morality. But reality dictates that most political agreements are quid pro quo, i.e., you scratch my back, I scratch yours. What exactly can Cardema offer that will overwhelm the overwhelming opportunity costs?

THIRD, Cardemas evidence will likely backfire.

Days after he initially accused Guanzon of extortion, Cardema released a series of screenshots that purportedly showed his text conversations with Guanzons alleged bagman in Congress. Cardema redacted the names, phone numbers, and numerous other parts of the exchange, thus raising questions regarding authenticity.

If anything, the screenshots may likely backfire on Cardema because the screenshots are essentially declarations against interest. One of the screenshots show that Cardema agreed to the lobby for the appointments of several people in exchange for a favorable Comelec decision, which sounds like a budding corruption case against Cardema.

Cardemas biggest mistake? Cardema didnt wait, even if a few weeks is all the waiting he had to do. If he just allowed the original first nominee to sit as congressman first then told her to withdraw a day later, the issue wouldve been under the jurisdiction of the House of Representatives Electoral Tribunal instead of Comelec, and he has better chances there.

But he didnt, so here we are.",RJ Nieto,09/07/2019,http://www.thinkingpinoy.net/2019/09/tponmb-duterte-youths-cardema-vs.html,Thinking Pinoy,Fake
#TPonMB: Policy suggestions to prevent the recruitment of Filipino youth into rebel groups,"Several parents of senior high school students testified in a series of Senate hearings that leftist groups believed to fronts for the communist insurgent New Peoples Army (NPA) are recruiting their children. And true enough, some of kids really went to the mountains and have become combatants for the rebel group.

I disagree with Leftist ideologies (I consider myself a Centrist) but I recognize every persons right to have her own political views. Advocacy of leftist ideologies is not by itself illegal, but it should stop when its about to lead our youth, most especially our very impressionable minors, into a life of violence.

Whenever I point out a problem, I always try to propose a solution.

Thus, here are several policy recommendations in relation to the issue:

[NOTE: This piece was first published in the Manila Bulletin on 17 August 2019].


FIRST, the state can set additional limitations on minors right to freedom of association.

The state recognizes the reality young Filipinos are not yet fully capable of independently making marriage decisions, so the Family Code (EO 209 s. 1987) requires adults aged 18 to 21 to secure notarized parental consent before they are legally allowed to marry.

The decision to go to the mountains and take up arms against the Government is much more serious than deciding to settle down. Just like what the Family Code with respect to marriage, the state can exercise parens patriae jurisdiction over our youth, to prevent them from making decisions that may destroy their future.

SECOND, schools can dissolve campus organizations that are known to advocate sedition and violence.

Liberality of school administrations vary widely but I believe that we can all agree that advocacy of illegal acts like sedition and rebellion is out of the question. Schools must immediately dissolve campus orgs as soon as they call for, say, the downfall of the government (e.g. Ibagsak!). DepEd and CHED, meanwhile, can take appropriate action against schools that neglect to do so.

THIRD, revoke legal recognition for organizations that encourage illegal acts.

Similar to the suggestion to schools, let us enable the Securities and Exchange Commission (SEC) to revoke the corporate registration of organizations that are known to call for the governments downfall. Criticizing the government and its policies is one thing, but to call for its utter destruction is another. While were at it, it may be high time to amend the Party-list Act (RA 7941) to exclude organizations that are known to advocate violence, or known to vocally support and/or tolerate groups that do so.


FOURTH, inclusion of insurgency-related topics in primary and secondary education.

Being a native of rural Bulacan, I was aware of massive NPA presence in Doa Remedios Trinidad town in the early 1990s because elders talk about it all the time. But thats about it. I didnt know that they extorted revolutionary taxes from innocent small businessmen, that they burn farm machinery, etc. Our children should be made aware of these things so they can make better decisions when NPA recruiters approach them later in life.


The government should also use its mass media assets to disseminate such information. Sadly, the Presidents own communications team (PCOO) does nothing significant in this regard. To this day, I have yet to see anything on TV, radio, print, or online that even remotely dissuades kids from joining the NPA. I strongly believe that its more important for PCOO to explain the scourge of violent resistance to Filipinos than to Bosnians.

FIFTH, amend the Human Security Act and the Anti-money Laundering Act (AMLA).

Section 18 of the Human Security Act (RA 9372) can be amended to extend the period of detention without Judicial Warrant of Arrest from just three days to at least a week for terrorism suspects.

Terrorism is best proven by retracing paper trails, and three days is simply too short for it. Imagine a terrorist that was arrested on a Friday night. Banks are closed during the weekends so law enforcement will have only one day (thats a Monday) to do all the work. Thats impossible.


With that said, AMLA should also be amended to include an exception on the predicate crime requirement if the offense is terrorism, albeit with additional safeguards to prevent authorities from using this for politicking. To this end, we can set harsher penalties for authorities who use AMLA-sourced anti-terrorism information for purposes other than countering terrorism.

To this day, I have yet to learn of persons in their late 20s or 30s who somehow had an epiphany of sorts and decided to join the NPA. In my best knowledge, NPAs new recruits are mostly those in their late teens and early twenties, i.e., young adults who are desperate to find meaning in their existence and to find their place in this world.

Lets build a framework that allows these children to learn that there are far better choices than taking up arms and shooting fellow Filipinos, because I know for a fact that there are.",RJ Nieto,09/07/2019,http://www.thinkingpinoy.net/2019/09/tponmb-policy-suggestions-to-prevent.html,Thinking Pinoy,Fake
"#TPonMB: Health Sec. Duque, lets respect FDAs independence","Department of Health (DOH) Secretary Francisco Duque recently announced that hell consult with the UP-PGH Dengvaxia Task Force regarding the possible reintroduction of the controversial anti-dengue vaccine Dengvaxia, saying he wants a decision on Dengvaxias fate through a consensus among all sectors because a lot of groups have varying positions about this.

But before we go any further, heres some context.
[NOTE: This piece was first published in the Manila Bulletin on 10 August 2019].

The 2017 Dengvaxia scandal stemmed from the haphazard DOH-led mass vaccination program affecting almost a million school-age children. Despite Sanofis own studies admitting that the drug may have serious adverse effects on recipients who have not had dengue, DOH still mass vaccinated in 2016 and 2017 4th graders in Central Luzon, Metro Manila, and Calabarzon.

The Scandal erupted in November, 2017, when Sanofi through a press release admitted that Dengvaxia worsens dengue symptoms in recipients who have no prior history of dengue, thereby confirming Sanofis earlier statement prior to the mass vaccination program, which Sanofi published in a peer-reviewed journal in 2015.

Hundreds of vaccine recipients have allegedly died so far, with Public Attorneys Office (PAO) autopsy reports show that most of the kids exhibited swelling and bleeding in their internal organs, which eventually led to multi-organ failure. The affected families, with PAOs help, have filed cases against DOH, manufacturer Sanofi, and local distributor Zuellig Pharma.

The cases are still pending in various courts and Sanofi has consistently denied liability over these deaths.
After Sanofi failed to submit mandatory post-marketing surveillance reports, the Food and Drug Administration (FDA) permanently revoked Dengvaxias Certificate of Product Registration (CPR) in February this year, making it illegal in the country.

Hence, I cannot understand why a health secretary is so actively involving himself over an illegal drug that is not even part of the Philippine National Formulary, the official list of drugs that the DOH is legally allowed to procure.


Criminal liability on the part of DOH, Sanofi, and Zuellig, in relation to the mass vaccination program, is a matter that the courts are already handling and lets allow them to decide on it. The issue at, is the propriety of the reinstatement of Dengvaxias CPR and subsequently, the question of who are the right persons to be involved its reinstatement.

Manufacturer Sanofi by nature wants Dengvaxias CPR reinstated, but its also clear that Congress mandated the FDA and no one else to review such submissions and Sec. Duque isnt in FDA.

As a side note, this writer also finds it odd that Dengvaxia advocate and former Health Secretary Esperanza Cabral has been doing media rounds lately without disclosing in any of those interviews that she is a trustee of the Zuellig Family Foundation, the philanthropic arm of Dengvaxia local distributor Zuellig Pharmaceuticals.

Former Philippine College of Physicians president Dr. Tony Leachon is right when he recently asked whether Sanofi has already submitted the post-marketing surveillance reports, as those missing reports are what made the FDA revoke Dengvaxias CPR in the first place.

If it still hasnt submitted these reports, then the debate is over. Otherwise, its up to the FDA and FDA alone to independently review these reports, check for compliance, and decide whether to reinstate Dengvaxias registration or not. With that said, this writer cant help but feel sympathy for the UP-PGH professionals who are now under extreme and unnecessary pressure.

If Sec. Duque insists on dipping his hands into the issue, then he must at least make public Sanofis missing post-surveillance reports that it must have submitted recently. The secretary should let the public see what Sanofi has to say about the hundreds of thousands of kids that, as Senator Richard Gordon put it, were treated like guinea pigs.

Dengvaxias proponents argue that the drug may be sufficiently safe for those who have had dengue, and this writer agrees with them. However, if Dengvaxia must be reinstated, then it must be reinstated with clear guidelines on how it should administered, taking into account data collected over the past three years that it was available in the market, the same data that can be found only in Sanofis post-marketing surveillance reports, the same reports that are still missing, apparently.

Sec. Duque is strongly encouraged to let the FDA do its job without undue external interference. FDA officer-in-charge Usec. Eric Domingo is more than capable of accomplishing that, especially since he hails from Pampanga, one of the provinces covered by the botched 2017 Dengvaxia mass vaccination Program.

Sec. Duque must focus only on tasks that he is legally allowed to do, and that doesnt include FDAs job. Truth be told, Sec. Duques latest moves may even be construed as engaging in acts beyond his authority to perform, opening him up to possible lawsuits from the FDA and even from any citizen who feels that the secretarys actions are endangering public safety.",RJ Nieto,09/07/2019,http://www.thinkingpinoy.net/2019/09/tponmb-health-sec-duque-lets-respect.html,Thinking Pinoy,Fake
"#TPonMB: What, exactly, is a legitimate journalist?","As I write my first column piece, I think its best to introduce myself first.

[NOTE: This piece was first published in the Manila Bulletin on 03 August 2019].


My name is Rey Joseph Nieto, best known as the publisher of the Facebook page Thinking Pinoy (TP) with over 1.4 million organic followers. I also a co-host the radio show Karambola, which airs weekdays 8 to 10 am on DWIZ 882 AM. And yes, I am that chubby controversial resource person in the October 2017 Senate hearing on fake news.

I am aware that social media is not the be-all and end-all of public discourse, hence my decision to start writing a column for one of the countrys most esteemed publications. And I am eternally grateful to Manila Bulletins senior editors for giving me this opportunity.

While were at it, I also wish to thank my mentors, the former SunStar Davao editor-in-chief Stella Estremera, Philippine News Agency director Gigie Agtay, and former Manila Standard editor-in-chief Jojo Robles (bless his soul): I would not have gone this far without you.

Now, lets get it on.
For the past three years, weve been witnesses to what appears to be a war for public recognition among media practitioners. On one side are new social media-based political personalities who enjoy massive online followings, and on the other are traditional journalists who benefit from massive distribution networks of their media outlets.

I now find this extremely ironic because I am a social media personality on one hand and with this first column piece, a traditional media man on the other. But just like what my late mentor Jojo Robles always told me, A journalist should never be his own story.


Let me cite a prime example, though I shall conceal her name because what matters here is the script and not the actor.

A few days ago, a traditional journalist publicly complained on social media about the Department of Transportations (DoTr) supposed preferential treatment, as the latter allegedly allowed a handful of media outlets, while preventing others, to cover the bidding on the New Manila International Airport. She also accused the agency of favoring social media personalities over, in her own words, legitimate journalists.

I called DoTr and they told me they dont really invite media in such events because theyre livestreamed anyway, and that media who were present had asked for access days in advance. DoTr said they wouldve granted the complainant access had she done the same, but she didnt. Thus, the issue seems to have stemmed not from inequitable treatment, but from a simple case of a bruised ego.

What I witnessed is a trait prevalent not only among traditional journalists, but also among social media players  the desperate need for validation.

Regardless of medium, legitimate journalists should let their work speak for itself. A legitimate journalist does not demand respect. Instead, he pours his heart, mind, and soul in every piece he writes, then silently wait for his audience to recognize and acknowledge his brilliance. Legitimate journalists dont go around town with a megaphone screaming how legitimate they are.

As Harvey Specter from Suits once said, Work until you no longer have to introduce yourself.

Journalists, I admit, are humans too. But then, those who aspire to make it into the Big League should see to it that their public statements should be like, borrowing the words of Arthur Miller, a nation talking to itself.

And no, I am not Gods Gift to Journalism. I am nowhere near that and I myself am guilty of having committed more than a few glaring mistakes. After observing mass media for several years as a regular citizen, however, I cannot help but feel great frustration over the work of many Filipino journalists today.

Social media personalities entered the limelight because they filled the vacuum that many traditional journalists left behind, a vacuum that was created after years and years of churning out work thats unresponsive to modern societys needs and tastes.

With that said, I strongly encourage traditional media to reclaim its dominance over Public Discourse, but this should be done not by pulling down newcomers, but by producing content that makes the Filipinos realize, by themselves, that what theyre reading is worth every second spent.

I didnt start this column to prolong the war between traditional media and social media. Instead, I started this to remind everyone out there, including myself, that journalism is about helping the Common Tao make the best possible decisions for his future. And that is possible only if we end this squabble and instead channel our energies towards building this nation that we all love.

Instead of making ourselves the story, lets focus on issues that are truly of national significance, in a way that the Common Tao will more readily and more willingly understand.",RJ Nieto,09/07/2019,http://www.thinkingpinoy.net/2019/09/tponmb-what-exactly-is-legitimate.html,Thinking Pinoy,Fake
