Headline,Content,Author,Date,URL,Brand,Label
In the service of the Filipino? How ABS-CBN's Lopezes used mass media since World War II,"Davao businessman Dennis Uy recently asked President Rodrigo Duterte for a sovereign guarantee to cover a Php 700 million loan for Uys Chelsea Logistics. Eyebrows rose, of course, including those of Bayan Muna chairperson Neri Colmenares.

A Sovereign Guarantee is a Government assurance that it will pay loans should the original debtor fail to pay them. That is, a sovereign guarantee means taxpayers will pay Chelseas loans if Chelsea fails to, after all.

Yes, I do understand the uproar, but, but I believe its still premature. For one, Malacaang has not even considered Uys request yet. Uy asked for a sovereign guarantee, but the President has not yet given one.

Besides, I sincerely doubt that Uy is a Lopez.

Wait! What? ABS-CBNs Lopezes again? Yes, those Lopezes again.


LOPEZ, BENPRES, AND NLEX
In an interview with DWIZ, former ABS-CBN journalist Jay Sonza accused the Lopezes of deliberately helping machinate the downfall of President Joseph Erap Estrada, after Erap declined the Lopezes request for a Sovereign Guarantee.

Sonza said:
Noong nakuha ng Benpres ang NLEX, itong North Luzon Expressway, kailangan nila (Lopezes) ng foreign funding para sa expansion, saka maintenance, modernization. E hindi sila makakuha ng funding kung hindi magkakaroon ng Sovereign Guarantee.
TRANSLATION: After Benpres acquired NLEX, the North Luzon Expressway, [The Lopezes] needed foreign funding for its expansion, maintenance, and modernization. But they cant get funding without a Sovereign Guarantee.
Benpres Holdings Corporation, now known as Lopez Holdings Corporation, is the parent company of all Lopez-owned firms, including ABS-CBN Corporation.

The BenPres building in Ortigas Center
Sonzas claim that the Lopez Group was in dire financial straits appears to be backed by a 2011 expose from veteran columnist Neal Cruz.

According to Cruz, the Lopez Group defaulted on Php 1.6 billion worth of behest loans from the government-owned Development of the Philippines, namely:
1. Maynilad, when it borrowed Php 710.86 million in 2000 then defaulted in 2003 after Maynilads balance sheets went Php 5.2 billion in the red. Maynilad, at the time, was 59.1% owned by the Lopez Family via Benpres Holdings.
2. BayanTel, when it borrowed Php 591.81 million in 1995 then started failing to amortize in 2001, when the outstanding balance was at US$ 11.2 million.
3. SkyCable, when it borrowed Php 207.10 million in 1997 and became past due in 2001.
4. Benpres Holdings, when it borrowed Php 157.95 million in 1996 and went past due in 2002 when Benpres stopped paying.
All these loans were written off. As to why, Id rather reserve that discussion for another article because this one is already very lengthy as it is.

LOPEZ FIRMS ALMOST WENT BANKRUPT
As you can see, three of the four loans were secured on or before the 1997 Asian Financial Crisis, which resulted in massive currency devaluations throughout the region. The Philippine Peso traded at 30 to a dollar in August 1997, then it exploded to Php 42 just five months later in January 1998. The peso continued to nosedive and by October 2000, the exchange rate was at Php 50.

The Lopezes earned in pesos and not dollars, so the dismal exchange rate caused their dollar-denominated loans to balloon to levels that crippled Bayantel and Maynilad.
A firm thats deep in the red in on a race against time: it has to start turning a profit before it goes totally bankrupt. Loans can give troubled companies more time to fix their act, but how can financial institutions lend to the broke?
The answer is simple: sovereign guarantees. If a loan is has government-backing, then theres little risk of default because taxpayers will, by law, shoulder the loan if the company defaults.

And according to Sonza, thats precisely what the Lopezes aimed for.

In the same DWIZ Interview, Sonza said:
Pinipilit si Erap na pumirma ng Sovereign Guarantee. Inayawan ni Erap. O e di inumpisahan si Erap hanggang matanggal.
TRANSLATION: They were egging Erap to sign the Sovereign Guarantee. Erap refused, so they started on Erap until he was deposed.

SONZA: LOPEZ ASKED ERAP FOR SOVEREIGN GUARANTEE
Sonza added:
Iniyawan niya yung Sovereign Guarantee diyan sa NLEx at sa Maynilad Water Services.
TRANSLATION: Erap refused to give Sovereign Guarantee to NLEx and Maynila Water Services.
While he was still in power, lots of companies pestered Erap for sovereign guarantees.


For example, while being cross-examined in his plunder trial, Erap told the Sandiganbayan:
I rejected that P40 million offered by Mark Jimenez because I did not want that sovereign guarantee provision in the contract. I knew that if Impsa fails to pay its debts, the government would assume its payment and that would badly affect the people.""
Erap was referring to the $470-million hydroelectric power contract between the Philippine government and Argentinian firm Industrias Metalurgica Pescarmona Sociedad Anonima (Impsa), where the prosecution alleged that businessman Mark Jimenez bribed the former president.

In a 2007 press statement about the plethora of sovereign guarantees issued by President Fidel Ramos to various power companies, Eraps son Senator Jinggoy Estrada said:
Hindi nya tinanggap yon dahil may sovereign guarantee. Ibig sabihin ginagaratiyahan ng ating bansa ung kontrata, ayaw ni Pangulong Estrada.
TRANSLATION: He didnt accept that because theres a sovereign guarantee (requirement). That means the State is guaranteeing the contract, which President Estrada didnt want.
Erap is no saint, but I cannot find a single record showing that Erap granted sovereign guarantees to anybody.

Moreover, the Estrada bio for the 2015 Most Outstanding Mayor Award (MOMA) states:
Determined to bring his pro-poor platform to every facet of the governments operations, he immediately ordered the removal of all sovereign guarantees on contracts for public projects xxx Reconds will show that until January 20, 2001, he did not sign a single government contract with a sovereign guarantee.
Sans claims to the contrary, I think its safe to say that Erap really didnt issue any sovereign guarantee. Im not commenting on the wisdom of his governance (or the lack of it), but the hard fact is that he didnt issue any sovereign guarantee.

ERAP VS THE LOPEZES ETC
Eraps unaccommodating stance must have had a catastrophic effect on the Lopez Group, whose subsidiaries were slowly dying one by one.

But a friendlier replacement may not come in time: Erap was still in the first half of his Presidency.

The Constitution states that only the President has the power to issue sovereign guarantees, so if I were someone who badly needs a major financial lifeline that only a President can give, then Id convince the President to give me one.

But he wont, so the next best thing is to wait for him to step down then ask the next president, but this one just got elected this year. Will my companies survive for the next six years?

Its not just Sonzas sovereign guarantee issue.

Erap in a 2006 speech said just three months into his presidential term, the Ayalas and Lopezes asked him to raise water rates by 80 percent.

Erap said:
I gained their ire when I turned down their request xxx my slogan is Erap para sa Mahirap xxx If I approve their request the poor Filipinos might rephrase my slogan into Erap Pampahirap.""
A loan is a loan, but a water rate hike is basically free money from the People.

Erap added:
Business is a gamble. If you lose in business, you cannot pass your losses to the people. If they win in their business, will they share it to the people?""
Well, if I were in the Lopezes shoes at a time like that, I may have wished for his deposal. And obviously, Id use ABS-CBN, which had a virtual monopoly on public opinion, to realize that goal.


Erap was deposed a little over two years later in January 2001.

I guess even the 1999 wedding of scion Beaver Lopez and Erap daughter Jackie Ejercito did nothing to change Erap's mind.

It's still a problem up to this day.

Yes, Erap made a lot of mistakes. But in as far as the possible motives for removing a president, I think money is most likely on the top of the list.

Sonzas claim that Lopezes use media assets to attack competing interests is not really new, as a 2000 peer-reviewed paper published by Cambridge University Press shows that the Lopezes have a long history of using media assets to attack their political opponents.

In Kinship Politics in Post-War Philippines: The Lopez Family, 1945-1989 , Mina Roces of the University of New South Wales narrated the Lopez Familys ascent from a regional economic power in Ilo-ilo to the wealthiest clan in the country.


The story is quite long, so Ill just focus on the parts that are immediately relevant to this discussion. Note that unless otherwise stated, all contents of the following sections are based on Roces paper.

THE MEDIA-POWERED RISE OF THE LOPEZES 
The massive Lopez fortune started with two Lopez brothers: Fernando, who was involved in Politics, and Eugenio Sr., who focused on business.

Fernando Lopez
Fernandos meteoric rise in Politics started in 1945 when President Sergio Osmena appointed mayor of Iloilo, and President Manuel Roxas reappointed him a year later. He eventually became the vice-president, then the Secretary of Agriculture and Natural Resources for three terms.


Roces wrote:
Thus began a symbiotic relationship between politics and business that thrived on the closeness of the two brothers. With one brother in politics, the Lopez family had the passkey to the realm of special privileges that gave them access to the credit and franchises sealed of to families deprived of political power. While one brother made political connections, the other was the shrewd and ruthless businessman who utilized these special privileges for the family business corporations.
The Lopezes bought the leading broadsheet The Manila Chronicle in September 1947, a critical juncture of Fernandos budding political career.


Roces noted that The Manila Chronicle never turned a profit, so she wondered why a business-savvy Eugenio Sr. kept it running for 24 years.

The Lopezes used the newspaper to all political and business enemies, including the President of the Philippines. Using the newspapers power to shape public opinion, the Lopezes forced political and business enemies to yield to the Lopez Familys demands.

Referring to The Manila Chronicle, Roces even said:
The paper was notorious for biased reporting.
Sounds familiar? Mhm, I know.

Fernando Lopez became a senator just two years into his mayoralty and just three months after acquiring The Manila Chronicle, which praised him all the time.


At a time when taxes from the sugar industry made up 43% of government revenue, the very powerful Lopez-led sugar barons in 1949 convinced presidentiable Elpidio Quirino to pick Fernando as his running mate.

Quirino didnt regret his decision, as The Manila Chronicle ran full-page ads for the Quirino-Lopez ticket while not placing any for rivals Laurel-Briones and Avelino-Francisco.


Backed by a major mass media company and the money of the all-powerful sugar bloc, Fernando became vice-president in 1949.

Fernando was Vice-president and Secretary of Agriculture and Natural Resources from 1949 to 1953 and from 1965 to 1971, and a senator in between.

While Fernando headed Agriculture and Natural Resources, Eugenio bought the following:
1: Binalbagan-Isabela Sugar Company (BISCOM), the largest sugar company in Southeast Asia that helped Sugar Bloc members expand their businesses 
2: Pampanga Sugar Mill (PASUMIL), which became the Lopezes second sugar central 
3: Philippine Portland Cement 
4: Industrial Company, which made the jute packaging for sugar 
5: ABS-CBN Broadcasting Corporation 
6: Manila Electric Company (MERALCO)
ABS-CBN is neither Agriculture nor Natural Resources, but I think its safe to say that the Lopezes learned from their ownership and control of The Manila Chronicle that mass media could do wonders.

BISCOM, PASUMIL, and Industrial Company fall under agriculture, while Philippine Portland Cement and MERALCO fall under Natural Resources.

And Fernando, at the time of their acquisition, was the Secretary of Agriculture and Natural Resources.

What a coincidence!

MACAPAGAL VS THE LOPEZ SUGAR BLOC
In the 1960s, President Diosdado Macapagal attacked the Lopez and what he called the Lopez Sugar Bloc when he argued that the Lopez and friends used their political connections to get loans from the government-owned DBP, Philippine National Bank (PNB), and Government Service Insurance System (GSIS).

Diosdado Macapagal with daughter Gloria
Included in the loans Macapagal listed are (M denotes million, K denotes thousand):
BISCOM  Php 32.49 M from DBP, Php 3.5 M from PNB 
PASUMIL  Php 4.788 M from DBP, Php 1.2 M from PNB 
Philippine Portland Cement  Php 2.355 M from DBP 
Industrial Company  P1.45 M from DBP 
ABS-CBN  Php 2.875 M from DBP, Php 485 K from PNB, Php 500K from GSIS 
Manila Chronicle  Php 2 M from PNB 
MERALCO  Php 35 M from PNB
Adding DBP and PNB loans of other Lopez companies, thats Php 88.373 million as of 1962.

Just how much is Php 88.373 million?
A peso in 1962 is equal to USD 0.27 so that Php 88.373 million equals USD 23.96 million. Using an inflation calculator, USD 23.96 million in 1962 is equal to USD 204.67 million in 2020. With the 2020 USD:PHP exchange rate hovering at around 1:50, then thats roughly Php 10.2335 billion pesos today.
That is, Php 88.373 million in 1962 can buy as many things as Php 10.233 billion in 2020.

Needless to say, the Lopezes again used their TV, Radio, and Print assets to prevent Macapagals reelection in 1965, or the year Ferdinand Marcos ran for president with Fernando Lopez as running mate.

And they did, as Roces wrote:
The Marcos-Lopez campaign was launched on January 6, 1965. During the entire year of 1965 The Manila Chronicle had almost daily reports on the activities and the speeches of both candidates, while the Macapagal Administration was continuously and ruthless attacked.
Macapagal and Pelaez stepped out, Marcos and Lopez stepped in.

Several years later, Marcos also tried to do what Macapagal did, i.e., wage war against the Lopezes. But this article is already running long, so lets talk about that on another day.

Regardless, whats clear is that based on this discussion, the Lopezes historically exploited their media assets to further their personal interests.

Amidst ABS-CBNs franchise renewal issue, I encourage everyone to keep it real: Let us stop deluding ourselves into thinking that ABS-CBN did nothing but be In the Service of the Filipino.

Just like you, I sometimes get shocked about what other people say, especially when their words go against what I have believed for the longest time.

But then, our political consciousness is shaped mostly by what we see on TV. But then, who ultimately decides on most of what we get to see on TV?

The Lopezes.",RJ Nieto,02/19/2020,http://www.thinkingpinoy.net/2020/02/in-service-of-filipino-how-abs-cbns.html,Thinking Pinoy,Fake
Rufino-Prieto firms cannibalizing the financially ailing Philippine Daily Inquirer?,"Documents show Philippine Daily Inquirers majority owners, the Rufino-Prieto Clan, are using their other family-owned companies to cannibalize what little is left of the newspaper companys assets, at the expense of minority stockholders who may be left with nothing if and when the media firm declares bankruptcy.

PDI sells land to Lexmedia
On 29 August 2018, Inquirer directors approved the sale of Inquirer-owned land near the Makati Central Business District. The board, at the time, is mostly made up of members of the Rufino-Prieto Clan, including:
Alexandra Sandy Prieto-Romualdez (President)
Carlos Rufino
Macario Rufino (Treasurer)
Paolo Prieto
Marixi Prieto
The sale involves six parcels of land totaling 1,990 sqm, where the Philippine Daily Inquirers head offices stand on . The Deeds of Absolute Sale  of the PDI-owned  lots show they were sold to a certain Lexmedia Reality Inc. for a total of Php 156,000,000, broken down as follows:
TCT No. 182449  324 sqm  Php 21,700,000
TCT No. 182450  331 sqm  Php 29,600,000
TCT No. 182451  340 sqm  Php 30,400,000
TCT No. 182452  340 sqm  Php 30,400,000
TCT No. 182453  331 sqm  Php 22,200,000
TCT No. 182454  324 sqm  Php 21,700,000
That is, the Rufino-Prietos sold the lots for no more than Php 78,392 per sqm.


A suspiciously low price
The sale price raises suspicion because the Zonal Value of the six Barangay Tejeros lots along Chino Roces Avenue is Php 120,000 per sqm based on Department of Finance Department Order 24-2017 .

To illustrate the point even further, listings for lots within the same general area are for much higher prices, one listing for a 641-sqm lot  is for Php 300,000 per sqm, while another listing for a 511-sqm lot  is for Php 245,000 per sqm.

Why were the Rufino-Prietos sell PDI-owned land, caring little about the losses they incurred for selling it at so much lower than market rates, to the detriment of PDI shareholders?

The Rufino-Prietos, for example, could have listed the land for 25% more or around Php 100,000 per sqm, and somebody wouldve readily bought it.

Oh! I almost forgot to mention that the sale includes all improvements in the six lots, including the Inquirer Building itself.

Lexmedia bought PDI land at lower than market value, implying that the Rufino-Prietos gave away the Inquirer building and all other improvements to Lexmedia FOR FREE.

Why did the Rufino-Prietos do what they did?
I honestly do not care if the Rufino-Prietos throw money on the streets. Still, we must remember that we are talking about the Philippine Daily Inquirer, which has minority shareholders comprised of lowly journalists who dreamt of a better economic future for themselves.

The decision to sell PDI land at scandalously low prices affects not just the Rufino-Prieto Family but also the minority shareholders who are not part of the PDI board that approved the sale.


PDIs owners as of 2018  show at least thirteen minority shareholders, including the veteran journalist Vic Agustin, who in October 2019 sued the Rufino-Prietos for Syndicated Estafa precisely for these allegedly onerous transactions .
Syndicated estafa is swindling committed by a syndicate of five or more persons. In Agustins lawsuit, that syndicate is the Rufino-Prietos.
The preceding section showed that the Rufino-Prietos, sitting as PDI directors, sold PDI land below-market prices, resulting in financial injury to PDI as a corporation because they couldve quickly sold the same land at a much higher price.

But then, an injury to PDI must also be an injury to the Rufino-Prietos, being that the latter are majority shareholders of PDI. That sounds contradictory, right?


Well, not if you check on who the Rufino-Prietos sold the PDI land to.

Who owns Lexmedia?
The Rufino-Prietos, acting as the agents of the Philippine Daily Inquirer, sold the six lots to Lexmedia, so that the next logical question would be who owns that company?

This is a tricky question because it appears that, based on documents from the Securities and Exchange Commission, Lexmedias ownership structure is buried in layers upon layers of corporations.


To illustrate, Lexmedias ownership structure  is as follows:
Pentap  40.56%
Mediacom  10.19%
Inquirer Holdings  10.15%
Corinthian  2.57%
Alexandra Prieto  3.83%
Carlos Rufino  0.83%
Paolo Prieto  2.42%
Others
(Note that from hereon, all mentions of any of the five Rufino-Prieto PDI directors will be highlighted in red.)

There are three Rufino-Prietos in the list (Alexandra, Carlos, and Paolo) but a majority of the shares belong to corporations (Pentap, Mediacom, Inq Holdings, and Corinthian), so lets check the ownership structures of each of these four owner-firms.


Pentaps owners:
Granprie  20%
Paolo Prieto  20%
Alexandra Prieto  20%
Others
Mediacoms owners :
LRP  68.92%
Others
Inquirer Holdings owners :
Pinnacle  68.89%
Others
Corinthians owners :
Marilex  31.85%
Ionian  11.19%
Macario Rufino  5.49%
Carlos Rufino  5.8%
Alexandra Prieto  1.82%
Marixi Prieto  1.86%
Paolo Prieto  1.82%
Others
At this point, you can see the names of the same Rufino-Prieto PDI directors are popping up. But we are not done yet, as we check the owners of the other corporations mentioned, namely Marilex, Ionian, LRP, Pinnacle, and GranPrie.

Marilexs owners :
Granprie  11.43%
Marixi Prieto  4.28%
Alexandra Prieto  8.57%
Paolo Prieto  8.58%
Others
Ionians owners :
Marixi Prieto  9.71%
Paolo Prieto  12.23%
Alexandra Prieto  12.23%
Marilex  14.1%
Others
LRPs owners :
Pentap  29.27%
Marilex  31%
Corinthian  4.24%
Carlos Rufino  1.37%
Alexandra Prieto  5.86%
Pinnacles owners :
Pentap  69.83%
Macario Rufino  8.51%
Alexandra Prieto  4.94%
Corinthian  3.58%
Carlos Rufino  0.99%
Paolo Prieto  0.04%
Others
Granpries owners :
Marixi Prieto  39.99%
Alexandra Prieto  31.98%
Paolo Prieto  0.01%
Others
Using data from the General Information sheets of each of the corporations mentioned above, I took the liberty of creating a diagram that illustrates the ownership structure of Lexmedia. The chart takes into consideration the intricate web of corporate layers that ultimately end in one or more of the same five Rufino-Prieto PDI directors.

A diagram showing Lexmedia's corporate ownership. Each large rectangle is a predominantly Rufino-Prieto family firm. Each red rounded box is a Rufino-Prieto family member who also sits in the Philippine Daily Inquirer's board of directors.

Note that based on the same General Information Sheets, one or more of the six PDI directors are also on the board of each of the corporations mentioned above.

These data show that after peeling off a sufficient number of corporate layers, Lexmedia appears to be primarily owned and controlled by the same five Rufino-Prieto directors of the Philippine Daily Inquirer.

In short, the Rufino-Prietos basically sold Inquirer-owned land to themselves.

Whats the problem with this?
PDIs Rufino-Prieto directors sold PDI-owned land to Lexmedia at a mind-bogglingly low price. The sale hurt the interests of PDI shareholders, and these are the Rufino-Prieto directors plus PDIs minority shareholders. Hence, why would the Rufino-Prietos hurt not only PDIs minority shareholders but also themselves?

As it turns out, the only ones hurt by the deal are PDIs minority shareholders, as Lexmedia, who bought the property at an extremely low price, is also owned and controlled by the same Rufino-Prieto PDI directors who approved the sale.

We know that the Inquirer has been hemorrhaging in as early as 2017, when declared Php 320 million in losses after tax . I personally doubt that the Inquirer can get out of the red and survive, especially since the Digital Age has brought the demise of newspapers all over the world. For example, more than 20% of all newspapers in the United States have closed down since 2014 .

Hence, I would understand why the Rufino-Prietos would try to hedge risk by evacuating assets from an ailing company. However, what I do not understand is how they can do it without taking into consideration the interests of other company owners who do not belong to their clan.

The Philippine Daily Inquirer was born in the late 80s as an earnest attempt to create a media company that is owned and controlled not by the moneyed elite, but by journalists themselves.

Initially intended to take the form of a journalist cooperative but registered as a corporation for expediency, the Inquirer started with the hope that all those working for it could share the responsibility and hopefully, the rewards .

Inquirer even had a very peculiar by-law in its original Articles of Incorporation: that only Inquirer permanent employees can own Inquirer stocks .

But this by-law didnt last long as the Rufino-Prietos took over in 1990s and established a virtual monopoly on Inquirers corporate decision-making.

Despite my strong reservations on the quality of Inquirers current fleet of journalists, I cannot deny the fact that the Inquirer was borne with the noble hope of giving journalists better lives without asking them to sell their bodies and souls to the devil.

Its bad enough that Inquirer failed to fulfill that promise, but what makes matters so much worse is that the same people who helped create their company  the minority shareholders  stand to lose whatever little they can get in the end.

As Lexmedia and the Rufino-Prieto companies, in apparent anticipation of Inquirers bankruptcy declaration, cannibalize whats left of the Philippine Daily Inquirers assets, what will happen to the minority shareholders, some of whom are even journalists themselves, who werent lucky enough to have Rufino or Prieto as a last name? 


And how about the Philippine Daily Inquirer's creditors, if any?",RJ Nieto,01/26/2020,http://www.thinkingpinoy.net/2020/01/rufino-prieto-firms-cannibalizing.html,Thinking Pinoy,Fake
